{
  "schema_version": "1.0.0",
  "opportunity_advantage_brief_id": "opportunity_advantage_pm_foresight",
  "workspace_id": "ws_productos_v2",
  "opportunity_summary": "Create a discovery and strategy layer that helps PMs spot important shifts before they become obvious.",
  "why_now": "AI makes synthesis cheap, which raises the bar from drafting to strategic leverage and early signal interpretation.",
  "why_us": "ProductOS already has traceability, workflow state, and artifact memory that can support high-trust sensing.",
  "hard_to_copy": "The defensibility comes from combining structured PM operating memory with critique, reliability, and portfolio context.",
  "learning_flywheel": "Every decision, contradiction, and later outcome improves future sensing and option framing.",
  "created_at": "2026-03-20T11:40:00Z"
}
